id,job_offered,analysis
p66,Yes,"Yes. The candidate seemed to have presented themselves in a professional and capable manner, highlighting their relevant skills and experiences. They also showed enthusiasm for the position and the company, which can be an attractive quality in a job candidate. Additionally, they effectively addressed the interviewer's questions about leadership, teamwork, and challenges faced while working on projects at MIT. However, it would have been beneficial to have seen some evidence of their technical skills and experience with projects, especially when discussing specific examples from their time at MIT. Nevertheless, overall, the interview gave a good impression of the candidate's strengths and potential for success in the role."
p67,Yes,"Yes. The candidate was offered a consulting position, and he has expressed his enthusiasm for it in various ways throughout the interview process. His ability to adapt to different situations, such as recognizing his own weaknesses and learning from them, and his willingness to work with diverse groups of people also suggest that he is a strong fit for this role."
p69,Yes,"Yes, the candidate got the job. The interviewer suggested the candidate consider interning at a company like MIT, which is considered a top-tier institution in the field of engineering, as this would provide them with valuable experience and qualify them well for future employment opportunities. This was the most relevant and compelling reason given by the interviewer to choose the candidate's job application."
p7,Yes,"Yes, the candidate got the job. The interviewer seemed to be impressed with his answers, asking thoughtful and specific questions about his experiences and weaknesses. He demonstrated leadership skills through his roles in student organizations, which suggests that he is a capable and effective leader. Additionally, he showed enthusiasm for working with the company and was willing to learn more about their culture and values.

The candidate also seemed to be aware of his own strengths and weaknesses, and was actively seeking help from others when needed. This self-awareness and willingness to learn are valuable traits that can contribute to success in a role.

Overall, the interview went well, and it seems likely that the candidate will get the job."
p70,No,"No. The candidate did not get the job. While they demonstrated leadership skills, such as forming partnerships and working on a team to address challenges, their weaknesses were not adequately addressed in the interview process. Additionally, the interviewer seemed more interested in exploring the candidate's potential for academic success rather than discussing their specific qualifications or experience in biological oceanography."
p71,No,"No. The candidate did not get the job. Although they demonstrated leadership skills, teamwork experience, and a strong educational background in mechanical engineering, their weaknesses, such as being out of their comfort zone regarding their studies, were not fully addressed. Additionally, they seemed to be relying on their parents' connections rather than showcasing their own strengths."
p72,No,"No. While the candidate demonstrated strong qualifications and interest in linguistic research, their lack of direct experience in leadership roles and occasional reliance on others to help them solve problems may have raised concerns about their ability to take charge independently. Additionally, their response to the question about overcoming shyness was somewhat vague and could be interpreted as lacking confidence in themselves. Overall, while the candidate showed potential, they may not have been the top choice for the job based solely on this interview."
p73,No,"No. While the candidate showed enthusiasm, leadership skills, and a willingness to learn from past experiences, their responses lacked depth and specific examples that would demonstrate how they would apply these skills in a real-world setting. Additionally, there were moments where they seemed uncertain or hesitant to share their thoughts, which may not have been suitable for a job interview."
p74,Yes,"Yes. The candidate was offered the position at MIT, likely after a rigorous interview process that included multiple rounds and assessments."
p76,Yes,"Yes, Zainab Lasisi got the job. 

She demonstrated leadership skills through her position as Vice President of the African Students Association at MIT, where she had to support the president and step in when necessary. She also showed strong communication and problem-solving abilities by working with international students on a project without clear guidelines, relying on creativity and asking for feedback from others. Additionally, she acknowledged her weaknesses, such as being an independent worker, and was actively working to improve those skills through development of communication skills."
p77,Yes,"Yes. The candidate's interview skills, communication abilities, and willingness to learn and grow during the conversation demonstrated a strong foundation for success in this position."
p78,Yes,"Yes. The candidate seemed interested and enthusiastic about the position, but there were some red flags that raised concerns about their fit for the role. For example, they mentioned that they don't have direct experience as a computer science major, which could be a concern if the company is looking for someone with more technical expertise. Additionally, they didn't provide much insight into their leadership style or how they would handle conflicts within the team, which could be an important aspect of working in a fast-paced tech environment. However, it's worth noting that they did demonstrate some transferable skills from their previous experience as the president of an acapella group, and they showed initiative by taking on additional responsibilities such as organizing publicity for the performance. Overall, while the candidate had some promising qualities, more information about their background, skills, and experiences would have been beneficial in making a more informed decision."
p79,Yes,"Yes. The candidate was offered a position at ITU, which suggests that they were selected for their skills, experience, and fit for the role. However, it's worth noting that the conversation did not provide specific details about the decision-making process, such as whether they demonstrated leadership or other competencies mentioned in the job description, so we cannot be certain of the outcome without additional context."
p8,No,"No. While the candidate showed enthusiasm and interest in the software development role, their lack of direct experience in the field, as well as some minor weaknesses such as staying focused on tasks and getting distracted, raised concerns that they may not have the necessary skills to excel in this position. Additionally, there were no specific examples or anecdotes provided that highlighted their strengths in data science and machine learning, which might have made up for these weaknesses."
p80,Yes,"Yes. The candidate was hired for the medical research position at UCSF, as confirmed by their responses and actions throughout the interview."
p81,Yes,"Yes. The candidate was offered a position in pharmaceutical law at a prominent law firm, and they expressed their gratitude for the opportunity to join the organization."
p83,Yes,"Yes. The candidate was offered a position at MIT, and it appears that they are strongly interested in pursuing their graduate studies in cognitive neuroscience there. Although the interviewer didn't explicitly mention the specific details of the job offer (e.g., salary, tenure track or non-track appointment), the tone of the conversation suggests that the university is willing to consider the candidate for a graduate program. Additionally, the fact that they were able to participate in a summer program at MIT and develop curriculum for sixth-grade students implies a level of engagement and interest from the university's side."
p84,Yes,"Yes, the candidate got the job. 

The interviewer seemed impressed with the candidate's experience, skills, and perspective, particularly in their research experience, leadership roles they've taken on at MIT, and international experience. The candidate demonstrated a strong understanding of materials science and engineering, as well as mechanical engineering, which was evident throughout the interview. They also showed enthusiasm for combining these two fields and taking on team-based challenges.

Additionally, the interviewer seemed to appreciate the candidate's self-discipline, cutting back on non-essential activities, and developing skills in areas such as time management, public speaking, and teamwork. These traits were highlighted during the conversation about their experience with international projects at MIT and their involvement in student organizations.

Overall, it appeared that the candidate had a strong foundation for success in the role they were interviewing for, and the interviewer was likely attracted to their unique combination of technical expertise, leadership experience, and cultural adaptability."
p85,Yes,"Yes. The candidate was offered the position of Research Engineer at a biotechnology company, which is a great fit for their skills and experience in engineering, computer science, and biology. Additionally, the opportunity to work on cutting-edge projects and collaborate with a talented team would be an excellent addition to their academic and professional development."
p86,Yes,"Yes. The candidate, being an engineering student at M.I.T., had a strong background in various fields including robotics, mechanical engineering, and electronics. He demonstrated leadership skills through his participation in a robotics group, where he took initiative to calm down his team members when they disagreed on the project's direction. His experience with team-based projects also showed that he could work collaboratively under pressure.

Additionally, he highlighted his ability to stay positive despite adversity by emphasizing the importance of looking towards the future and staying motivated. This is evident in his story about working on a final robot project and then taking additional time off to focus on it.

The candidate's weakness, if not addressed directly during the interview, could be seen as his lack of attention to detail in regards to time management. However, he did show improvement by creating a schedule and prioritizing tasks more effectively.

Overall, the candidate presented himself as well-rounded, capable, and motivated, which are all desirable qualities for an engineer. His enthusiasm and confidence in sharing his experiences were also impressive.

Based on this interview, it seems likely that the candidate would get the job."
p89,Yes,"Yes. The candidate was offered a position in their desired technical field, electrical engineering, within their physics major program at MIT. While there were no specific details provided about the job offer, it appears that the candidate's qualifications and experience as a physics major with interests in electrical engineering align well with the requirements of the position they expressed interest in."
pp1,Yes,"Yes, the candidate appears to have had a productive and insightful conversation with the interviewer. While there were some minor moments of discomfort with being asked to speak at length (which is understandable given the format), the overall tone seemed professional and engaged.

The candidate's discussion about their background, interests, leadership style, team player qualities, conflict resolution skills, and aspirations for academia all provided valuable insights into their personality and potential fit with the company culture. The examples they shared about their experiences in computer science and biology labs and their involvement in Camp Kesem demonstrated a strong work ethic and commitment to using their technical skills for positive social impact.

The candidate's self-awareness and willingness to be open and honest about their limitations (e.g., not being a leader in academia) also suggested that they were reflective and humble, which are desirable traits in an employee.

Overall, it seems likely that the candidate was successful in their interview and will move forward in the process."
pp10,Yes,"Yes. The candidate demonstrated strong qualifications and skills for the position, including his background in aerospace engineering, experience with fluid mechanics and control systems, and interest in rotorcraft design and analysis. He also showed self-awareness about areas for improvement, such as written communication skills. Additionally, he expressed enthusiasm for the company's work and role, which suggested a strong potential fit. However, it was not explicitly stated that he got the job, but rather that he expressed his interest in proceeding to the next step in the process."
pp11,No,"No. While the candidate showed a good understanding of finance and leadership concepts, their responses lacked depth and showed some significant gaps in their answers. For example, when asked about their approach to conflict resolution, they mentioned forcing team members to compromise and focus on presentation outcomes, which doesn't necessarily demonstrate effective conflict resolution strategies. Additionally, they didn't explicitly address potential concerns about their communication style or the need for more outgoing behavior. Overall, while the candidate demonstrated some relevant skills and experiences, their responses fell short of showcasing a clear understanding of the role and company, making it challenging to determine if they would be a strong fit for the position."
pp12,Yes,"Yes. The candidate appeared to have a strong foundation for success in the role, showcasing their leadership skills, ability to communicate effectively, and willingness to learn and grow. They also demonstrated their passion for robotics and product design, which aligns with the company's interests. However, there were some areas where they could improve or work on.

One potential area of improvement was that they mentioned feeling overwhelmed by a variety of interests and not having time to focus on one thing at a time. This is a common challenge for students who are juggling multiple academic and extracurricular commitments. To address this, the candidate could have discussed strategies for prioritizing their interests and managing their workload.

Additionally, while they expressed enthusiasm for learning from existing employees, it would be beneficial to elaborate on specific skills or areas of interest that they believe would be valuable in contributing to the company's success.

Overall, however, the candidate demonstrated a strong understanding of the role and the company, and their passion for robotics and product design was evident. With some refinement and further development, they could be an excellent fit for the position."
pp13,Yes,"Yes. The candidate was selected for the job due to their strong background in engineering, particularly electrical engineering and computer science, as evident from their academic track record (studying at MIT) and work experience in various labs and companies in the field. Their ability to innovate and take charge of projects, such as leading the MIT SAE team and designing a website for Promex Industries, also demonstrated their potential as a leader. Additionally, their communication skills were showcased through their ability to effectively collaborate with team members and present ideas on the website project. Overall, the candidate's technical expertise, leadership experience, and strong work ethic made them an attractive candidate for the position."
pp14,Yes,"Yes. Although the interviewer did ask some tough questions, the candidate showed great improvement throughout the conversation and demonstrated a strong foundation in computer science knowledge and skills. The candidate's ability to showcase their technical expertise and leadership qualities was impressive, and they effectively communicated these strengths through their responses. Additionally, they shared some compelling personal anecdotes that highlighted their growth as a person and leader, which helped to build rapport with the interviewer. Overall, it seemed like the candidate had done an excellent job of demonstrating their qualifications and potential for success in the role."
pp15,Yes,"Yes. The interviewer seemed to be impressed with the candidate's background and qualifications, as evidenced by their thoughtful responses to each question. They also asked follow-up questions that demonstrated a genuine interest in learning more about the candidate's experiences and skills. Additionally, the candidate's self-awareness and willingness to admit areas for improvement showed that they were proactive and self-reflective. Overall, it seemed like the interviewer had found someone who was a strong fit for the position, but ultimately decided not to offer them the job due to scheduling constraints or other logistical reasons."
pp16,Yes,Yes.
pp17,Yes,Yes. The candidate was offered and accepted the position at MIT's Game Lab.
pp20,No,"No. The reason is that although the interviewer asked several thoughtful and specific questions about the candidate's experience, leadership skills, and career goals, they did not seem to be genuinely interested in learning more about their qualifications or experiences. They mostly picked up on phrases like ""I've stepped up"" or ""I'm excited about going into this field,"" which seemed superficial and lacking in depth. Additionally, they didn't ask any follow-up questions that would have allowed them to delve deeper into the candidate's thought process or experiences."
pp21,Yes,"Yes. The candidate seemed to have a strong background in computer science and engineering, which aligned well with Google's technical requirements. They also demonstrated leadership skills through their experience as editor of MIT student newspaper, showcasing their ability to work collaboratively and effectively manage teams. Additionally, their communication skills were impressive, as evident from the example they provided about resolving conflicts in their team projects. Overall, it seemed like the candidate had a solid foundation that could contribute to Google's success."
pp22,No,"No. While the interview was informative, it seemed that the interviewer did not take note of the candidate's passion for consulting and their leadership skills, which were highlighted in several areas of the conversation. Additionally, the candidate had expressed a desire to work on different projects and be more proactive about meeting deadlines, but these points were not fully explored or discussed during the interview."
pp24,Yes,"Yes. Although the candidate's answers provided some insightful information about their qualifications and leadership skills, they also revealed several areas where they could improve to become a more effective leader in a professional setting."
pp25,No,"No. While the candidate demonstrated some excellent qualities such as a strong educational background, technical expertise, and leadership skills, they also struggled with organization, time management, and prioritization. Additionally, there were some signs of conflict within the team, particularly regarding the project choices. These red flags raised concerns about the candidate's ability to work effectively in a team environment and manage competing priorities."
pp27,No,"No. Although the candidate showed significant research experience, a strong understanding of chemical and biological principles, and relevant coursework, their inability to articulate clear goals for using their skills in a professional setting, coupled with some awkward pauses and hesitations during the interview, raised concerns that they may struggle to effectively communicate their abilities and motivations to employers."
pp29,Yes,"Yes. The candidate was offered a position at MIT, which they accepted due to their strong technical experience background, willingness to take charge and lead others, ability to handle conflicts professionally, and perspective that provided a unique advantage in problem-solving. Additionally, the candidate's desire to improve on areas such as thinking faster on one's feet, particularly under pressure, demonstrates a commitment to growth and self-improvement, which is often seen as an attractive quality in potential employees."
pp3,Yes,"Yes, based on my analysis of the conversation, it seems likely that Chase was offered and accepted a position at the company. Here's why:

* The candidate had a clear passion for their work, which suggests that they would be motivated to excel in the role.
* They demonstrated creativity in expressing their thoughts, such as describing how they approach problems and what makes them tick.
* They showed enthusiasm and energy about working on projects, even when it seemed like they were ""tired"" of working (i.e., during classes).
* The candidate's ability to articulate complex concepts in simple terms was impressive.
* They highlighted their strengths, such as being able to explain their ideas clearly and efficiently.

However, it's worth noting that the conversation did not provide a clear indication of whether Chase had actually been offered or accepted the job. To determine this for sure, I would need to review the candidate's follow-up questions and any further conversations they may have with the interviewer."
pp30,Yes,"Yes. The candidate, a junior student of computer science at MIT, appears to have demonstrated strong skills and qualities that would make them an excellent fit for the position. They provided insightful answers about their background, leadership experiences, and team dynamics, showcasing a unique perspective as both a leader and a team player.

Their self-deprecating humor and willingness to admit areas where they struggle suggest a humble and growth-oriented individual who is not afraid to ask questions or seek feedback.

The candidate's passion for computer science, particularly in languages and puzzle solving, demonstrates their strong foundation in the field. However, it would be beneficial if they could highlight more specific examples of how these skills have been applied in real-world scenarios, such as teaching at a startup in Venice Beach, California.

Their confidence and enthusiasm for the company's mission and values suggest that they are genuinely interested in the role and would be a strong fit for the organization. Overall, the candidate presents themselves as articulate, thoughtful, and motivated, making them an attractive candidate for the position."
pp31,No,"No. While the candidate demonstrated some great qualities such as technical competence, leadership skills, and a passion for computer science, there were also several areas that raised concerns about their fit for the role and company culture. For example, they mentioned that they tend to be ""snippy"" when stressed or tired, which could impact team unity and happiness. Additionally, they expressed some reservations about working with their voice, specifically their tendency to respond in a way that may escalate situations rather than resolving them constructively.

Furthermore, while the candidate did mention that Amazon was a great company that would provide interesting technical problems, it seemed unclear whether this would be a good fit for them in the long run. They also mentioned that they were not willing to ""bid their time away"" waiting for the work day to end and instead wanted to be on time and leave early.

Overall, while the candidate showed some promising qualities, it seems unlikely that they would be the best fit for this particular role or company culture."
pp32,Yes,"Yes. The candidate was offered the position of a junior at MIT, and it appears that they were selected for this opportunity based on their strong leadership skills, ability to work effectively with teams, and willingness to take initiative. They also demonstrated good communication and organizational skills, which are essential for success in a high-pressure environment like an internship or research program."
pp33,Yes,"Yes. The candidate appeared to have a strong background in energy work, particularly in chemical engineering, and had expressed interest in alternative energy as well as optimizing traditional energy resources. They also demonstrated leadership skills, including taking initiative, problem-solving, and collaboration. The candidate's answer on their role as a team player showed that they were able to understand the importance of being part of a cohesive team and that they took responsibility for contributing to the team's efforts.

The candidate also effectively addressed potential conflicts or challenges in the workplace, such as missed events and student selection. They demonstrated strategic thinking and problem-solving skills by finding ways to mitigate these issues and still achieve their goals.

Overall, it seemed like the candidate had a solid understanding of their strengths and weaknesses and was confident in their ability to contribute to the company's success. Therefore, I believe they would be a strong fit for the position."
pp34,No,"No. While the candidate demonstrated many excellent qualities, such as enthusiasm for product design and leadership skills, their responses often lacked clarity and specific examples to support their claims. Additionally, there were several instances where they struggled to articulate their thoughts in a clear and concise manner. These inconsistencies may have raised concerns about their ability to effectively contribute to the team and meet the demands of the position."
