id,job_offered,analysis
p10,Yes,"Yes. The candidate demonstrated strong leadership skills through their experience as a team leader during their Freshman year at MIT, and their ability to articulate their thought process and decision-making in various scenarios. They also showed a willingness to learn and improve, taking feedback from others and actively working on developing their written communication skills. These traits are typically valued in many professional settings, making the candidate a strong fit for the position."
p11,Yes,"Yes. The candidate was offered a position at MIT's finance consulting firm, although it appears that they were ultimately not hired for this role specifically. The interview process seemed to be focused on assessing their leadership abilities and experience, which aligned with the requirements of the consulting position. However, it does seem that the firm was looking for someone with more specific skills in areas like quantitative analysis and investment banking, which the candidate demonstrated through their academic background and internship experiences."
p12,No,"No. While the candidate showed enthusiasm and interest in the company, their inability to articulate specific accomplishments, challenges they overcame, and strategies for improvement made it difficult to assess their fit for the role. Additionally, their tendency to speak vaguely about leadership and teamwork without concrete examples raised concerns about their ability to execute responsibilities effectively. Overall, while the candidate demonstrated some potential, their lack of specificity and clear communication skills hindered their chances of being hired."
p13,Yes,"Yes. The candidate was offered a position at Promex Industries after a thorough interview process, which included assessing their technical skills, leadership abilities, and fit for the company culture. While they demonstrated strong quantitative and qualitative skills, as well as effective communication and teamwork abilities, there were also some signs of potential weaknesses that could be addressed in an interview setting. However, overall, the candidate's enthusiasm for the company and its work was evident, which may have been a deciding factor in the hiring decision."
p14,Yes,"Yes. The candidate was offered the position and they accepted it. My reasoning is that during the interview, the candidate demonstrated strong technical skills in areas such as computer science, web development, and programming languages, which are highly valued in the industry. They also showcased their ability to work well with others, both in a team setting and through leadership roles. Additionally, their communication skills were impressive, particularly in explaining complex technical concepts in an easy-to-understand manner. Overall, the candidate's qualifications and strengths made them an attractive candidate for the position."
p15,Yes,"Yes. The candidate was well-prepared and demonstrated excellent communication skills during the interview, showcasing a strong understanding of their background, experiences, and qualifications. They provided specific examples from their past work and research experience to illustrate their leadership abilities and problem-solving skills. Additionally, they highlighted their passion for working with others and their commitment to effective communication. Overall, the candidate presented themselves as a strong fit for the position, showcasing qualities that would be beneficial in a role at Met Life."
p16,Yes,"Yes. The candidate, despite some flaws in their approach to leadership and problem-solving, demonstrated a strong understanding of the importance of collaboration, adaptability, and time management in group settings. Their willingness to learn from past experiences and apply new skills to address challenges is also commendable.

However, the interview could have benefited from more nuanced feedback on areas for improvement, such as explicitly addressing their tendency to rely too heavily on others' ideas without taking ownership of their own contributions. Additionally, providing concrete examples or case studies to illustrate their leadership skills in a real-world context would have been helpful.

Overall, while the candidate's enthusiasm and eagerness to learn were evident, they could benefit from further development in areas such as critical thinking, time management, and self-reliance. With targeted training and practice, they may be able to refine their approach to leadership and achieve greater success in their future endeavors."
p17,No,"No. 

The interviewer seemed more interested in hearing about the candidate's strengths, weaknesses, and experiences than in assessing their qualifications for the position at Google. While the candidate demonstrated some leadership skills through their experience working on group projects, there were no specific examples of technical expertise or achievements that would have indicated they could make a valuable contribution to the company.

Additionally, the interviewer asked follow-up questions that seemed designed more to probe the candidate's personal qualities and life experiences rather than assess their knowledge of computer science concepts or technical skills. The candidate's discussion of being quiet as a child did not seem directly relevant to the conversation about their qualifications for the position at Google.

The final question about why they thought the candidate should be hired was also more of an opportunity for the candidate to showcase their personality and fit with the company culture rather than an objective assessment of their abilities."
p20,Yes,"Yes, they did get the job. The interviewer asked specific and thoughtful questions throughout the interview that allowed them to gauge the candidate's knowledge, experience, leadership skills, and communication style. They also showed interest in the candidate's weaknesses and how they were working on improving those areas. Additionally, the candidate demonstrated a strong work ethic and enthusiasm for their role, which are all positive factors in securing a job offer."
p21,Yes,"Yes. The candidate, Dina Wong, appeared to have a solid academic record and demonstrated strong leadership skills through her involvement in campus life and extracurricular activities such as cross-country team. However, the interview also revealed some areas where she may need to improve, including her self-doubt and ability to apply theoretical knowledge to practical situations. Nevertheless, based on the information provided, it seems that Dina Wong has a strong foundation for future success in the field of computer science."
p22,Yes,"Yes. The candidate was hired for the aerospace engineering position at MIT, likely due to their diverse skill set and unique background, which included working with various cultures, having international experience, and holding relevant professional certifications such as a degree in aerospace engineering from MIT. Additionally, their experience at Space-X and NASA also demonstrated their technical expertise and industry knowledge."
p24,Yes,"Yes. The candidate was offered a position at MIT, which is a prestigious institution for biomedical research and education. The interviewer noted that the candidate demonstrated leadership skills through their experience on a summer camp trip to Israel, where they helped facilitate group activities and ensured the well-being of their peers. They also highlighted the candidate's ability to work effectively in teams, particularly in a lab setting, where they took initiative to borrow materials and checked down the hall for assistance. The interviewer was impressed by the candidate's self-awareness, including their tendency to be shy and remind themselves to add value beyond just being an individual contributor. Overall, the candidate demonstrated strong potential as a leader in biomedical research and education, and the interviewer believed that they would thrive at MIT."
p25,No,"No. While the candidate did have relevant experience and skills, their tendency to be disorganized and lack attention to deadlines made it difficult for them to meet the expectations of a job in JPO, particularly considering they would be working on high-priority projects such as interplanetary rovers. Additionally, their lack of clear decision-making skills during the Dropsonde project highlighted potential issues that could arise in complex technical environments."
p27,Yes,"Yes, the candidate was offered the leadership position in their house government at M.I.T."
p29,No,"No. While the candidate demonstrated leadership skills, communication abilities, and technical expertise, their tendency to voice opinions too frequently without considering others' perspectives made them a less-than-ideal fit for the role they were interviewing for. Additionally, the candidate's lack of initiative in discussing concerns and not being able to address problems effectively made it difficult to envision them taking on leadership roles within the organization."
p3,Yes,"Yes. The candidate demonstrated strong passion, teamwork skills, and a willingness to learn and grow through their conversation. They expressed genuine interest in the position and its requirements, and showed enthusiasm for contributing to a team. Additionally, they highlighted specific weaknesses that they were actively working on improving, which suggested a growth mindset and self-awareness.

The way they approached questions and provided specific examples of their experiences also demonstrated their ability to think critically and communicate effectively. Their answers were concise, yet informative, and showed a clear understanding of the company's goals and challenges.

Overall, while there wasn't any dramatic or earth-shattering moment during the interview, the candidate's overall demeanor and performance suggested that they could be a strong fit for the role."
p30,No,"No. Although, there were some positive points during the interview, such as Nikki's self-awareness about her quiet nature and her willingness to learn quickly, these traits alone may not be enough to secure a job offer. The fact that she mentioned she would work hard and don't want to let people down also shows potential, but it's essential to consider other factors like her communication style and how well she can adapt to the MIT environment. Additionally, Nikki didn't directly address any concerns or questions from the interviewer regarding her qualifications, experience, or fit for the role."
p31,Yes,"Yes. The candidate demonstrated strong communication skills, teamwork abilities, and interest in distributed systems, which are key aspects of the position they were applying for. They also provided specific examples from their experiences that showcased these skills. Additionally, they showed a willingness to learn and improve, as evident from their discussion about addressing their snippy tendencies by practicing relaxation techniques during difficult interactions with team members."
p32,Yes,"Yes. The candidate demonstrated strong leadership skills, including delegating tasks effectively and communicating with team members to ensure smooth project execution. They also showcased their ability to adapt and learn from feedback, as seen in their conversation about addressing the challenges of working on a modular project. Additionally, they expressed self-awareness and a willingness to improve by recognizing areas where they could contribute more fully to the group. Overall, these traits suggest that the candidate would be a valuable asset to the organization and would likely excel in the role."
p33,Yes,Yes.
p34,Yes,"Yes. The candidate seemed to have made a strong impression throughout the interview, showcasing their passion for product design, ability to work well in teams, and willingness to learn and grow as an individual. They provided specific examples of challenging situations they overcame, such as managing conflicting ideas and personalities on a team project. Additionally, they highlighted areas where they are actively working to improve, such as building assertiveness and confidence.

Overall, the candidate demonstrated a clear understanding of what it takes to be successful in product design and a genuine interest in the role at the university. It's likely that the hiring committee will view them favorably and consider offering them the position."
p35,Yes,"Yes. The candidate demonstrated leadership skills, a strong academic background in Computer Science and Biology, as well as experience working on teams and overcoming challenges. They also showed initiative in seeking out additional leadership development opportunities, which is an attractive quality for potential employers. However, it would be beneficial to see more concrete evidence of the candidate's ability to work collaboratively with others, such as providing examples from their past experiences or demonstrating a willingness to learn from feedback."
p37,No,"No. Although the interviewer seemed to be impressed with the candidate's qualifications and experience, his lack of initiative in pursuing academic challenges, especially outside of the minimum requirements for their degree, was a major concern. The fact that he didn't push himself hard enough academically also raised questions about his long-term commitment to the field."
p4,Yes,"Yes, the candidate got the job. The interviewer seemed impressed with the candidate's qualifications and experience, particularly in their aeronautics and astronautics background at MIT. They also appreciated the candidate's ability to articulate their weaknesses and how they plan to overcome them (in this case, by getting ahead of time). Additionally, the candidate demonstrated strong research skills through their examples, which suggests that they would be able to contribute valuable insights to the company. The interviewer also seemed enthusiastic about the candidate's potential fit for the role, indicating a positive hiring decision."
p42,Yes,"Yes, the candidate was hired for the position of aeronautics team leader in the Air Force ROTC program."
p43,Yes,"Yes, the candidate got the job. 

They presented a strong case for themselves, highlighting their technical expertise, business acumen, and product management skills. They also demonstrated self-awareness about areas where they could improve, such as delegating tasks effectively. The candidate's experience at Disney, particularly with REX Event, showed that they can handle complex challenges and lead teams to achieve results. Additionally, their response to the interviewer's question about their greatest weakness was thoughtful and constructive, suggesting that they are aware of potential areas for improvement and are actively working on them. Overall, the candidate's confidence, passion, and qualifications made a strong impression on the interviewer."
p44,Yes,"Yes. The candidate, Evan Muray, seemed to impress the interviewer with his enthusiasm and interest in computer science, as well as his relevant extracurricular activities that showcased his leadership skills and problem-solving abilities. He provided specific examples from his experiences, such as coordinating Camp Kesem MIT and leading a dance troop, which demonstrated his ability to work effectively in teams and think creatively. The interviewer seemed to be impressed by Evan's ability to adapt to new situations, take initiative, and use their ideas to build solutions. Overall, the candidate presented himself well and appeared to have a strong understanding of computer science concepts, making it likely that he would get hired for the job."
p45,Yes,"Yes. The candidate was offered a position at the behavior study lab. This suggests that they effectively demonstrated their skills and qualities, particularly their ability to work in teams, manage multiple tasks, and think critically and creatively. They also appeared confident and articulate during the interview, which is a positive indicator of their fit for the role."
p47,No,"No. While Skylar showed enthusiasm and interest in the position, his lack of specific examples from their MIT experience, especially regarding leadership roles or challenges faced while working on team projects, raised concerns about his preparedness for a real-world job. Additionally, his responses were somewhat vague and lacked concrete details that would have helped to build confidence in his abilities."
p48,No,"No. While the candidate demonstrated leadership skills and problem-solving abilities, their lack of relevant work experience in computer science and nuclear engineering made it challenging to convincingly showcase their skills in a traditional interview setting. The interview focused primarily on their academic background and extracurricular activities, which may not have fully prepared them for the technical aspects of a programming job in the startup industry."
p49,Yes,"Yes. The interviewer was impressed by the candidate's self-awareness, ability to overcome challenges, and persistence in pursuing their goals despite obstacles. They also appreciated his unique approach to problem-solving and his experience working in a high-pressure environment like MIT. However, it's worth noting that the candidate didn't seem to have all the answers or be entirely confident about their abilities, which is not uncommon for early-stage job applications.

Additionally, while the candidate showed enthusiasm and interest in the field of oncology and medical research, there were some moments where his responses seemed to lack confidence or conviction. For example, when discussing a particularly challenging group project, he attributed his difficulty with an obstacle rather than acknowledging areas where he needed improvement. Nevertheless, overall, the candidate demonstrated many desirable qualities that could make him a strong candidate for a future role in the field of medicine or research."
p5,No,"No. While the interview provided a good insight into the candidate's personality, leadership skills, and willingness to learn, it was limited in its depth and breadth when considering whether they would be a strong fit for the role and organization. The interview did not delve as deeply into the candidate's long-term goals or how their skills align with the company's overall objectives. Additionally, while the candidate demonstrated some creative problem-solving skills, there were no specific examples provided of how they applied these skills in a work setting to drive significant results."
p50,Yes,Yes.
p52,No,"No. Although the interviewer seemed to be interested in the candidate's qualifications and provided some positive feedback, the tone of their questions came across as somewhat condescending and patronizing at times, particularly when it came to discussing challenges they had faced in their rowing career. The interviewer also used phrases such as ""I'm sure"" and ""hopefully that interest will inspire me,"" which made the candidate feel like they were being evaluated based on how much effort they would put into the job rather than any genuine assessment of their qualifications or potential. Additionally, there was no clear explanation of what specifically made them a strong candidate for the job beyond the surface-level qualities mentioned in the interview."
p53,Yes,"Yes. The candidate was offered the position of pediatrician at a hospital in Boston, and it is likely that they accepted the offer. There were no indications throughout the interview process that the candidate declined the offer, which suggests that they are interested in pursuing this career path. Additionally, the candidate's experience as an executive board member at MIT, their involvement with student groups, and their willingness to take on leadership roles suggest that they have a strong foundation for success in medical school and beyond."
p55,Yes,"Yes. The candidate was offered the position of junior analyst at the company, with the terms and conditions specified in the interview. However, it's worth noting that this decision is likely to be based on a single interview, and further evaluation would be necessary to determine whether they are the best fit for the role and the organization."
p56,Yes,"Yes. The candidate was offered a position in medical school, and it appears that they were accepted after an interview process that included multiple rounds of interviews with the faculty members at the university."
p57,Yes,"Yes. The candidate was invited for a follow-up interview and eventually received an offer from the company, indicating that they were selected for the position."
p58,Yes,"Yes. The candidate's strong academic background, relevant work experience in Ocean Engineering, leadership skills demonstrated through restarting an organization and a project, and their enthusiasm for working on teams suggest that they would be a valuable asset to the team at MIT."
p59,Yes,"Yes, the candidate was offered a position at a reputable hospital. 

The interviewer asked about the candidate's weaknesses and how they plan to overcome them. The candidate mentioned being a perfectionist, which led to some humorous responses, but ultimately, it became clear that this is something they can work on. They also discussed why they want to become a doctor, highlighting their passion for helping others and desire for personal fulfillment.

The candidate's discussion about leadership and teamwork was impressive, showcasing their experience as an EMT and willingness to take on extra responsibilities. The interviewer asked about challenges the candidate faced when working with a team, and they provided a thoughtful response emphasizing the importance of hard work, preparation, and perspective.

Finally, the candidate shared why they think they should get into medical school, highlighting their desire for personal fulfillment, interaction with patients, and impact on society."
p6,Yes,"Yes, the candidate got the job. 

The reason is that despite having a number of weaknesses such as not having a formal education in finance and limited experience working in finance, the candidate demonstrated significant initiative, hard work, and a strong desire to learn and grow. Additionally, their willingness to take calculated risks, network with colleagues, and demonstrate technical skills was impressive. The fact that they were able to overcome their weaknesses by actively seeking out help and learning from their mistakes also suggested that they were motivated and capable of success in the role."
p60,Yes,"Yes. The candidate was offered the position of junior at MIT, and he accepted it."
p61,Yes,"Yes, I believe the candidate was hired. The conversation flowed smoothly, and the interviewer asked thoughtful questions that allowed the candidate to showcase their skills, experience, and personal qualities. The tone of the conversation was professional and positive, with no major red flags or concerns raised during the interview. Overall, it seemed like the candidate had a strong chance of being hired for the naval aviation position."
p62,No,"No. The candidate, Juliann, did not appear to have a strong track record of demonstrating leadership and teamwork skills in her responses. While she mentioned working on a team project and facing challenges, these interactions were relatively minor and didn't showcase any particularly notable examples of leadership or problem-solving. Additionally, she struggled to articulate specific strategies for overcoming weaknesses such as self-confidence, which is a significant concern for medical school admissions. Her focus on research experience and extracurricular activities, while relevant to her interests in the field, did not provide sufficient evidence of her potential to excel in a clinical setting."
p63,Yes,"Yes. The candidate was offered the software engineering position at the company, and they expressed their gratitude for the opportunity to join the team and learn from the organization."
p64,No,"No.

Reasoning:
The interview was conducted in a relaxed atmosphere, and the candidate's answers were somewhat self-deprecating, which is consistent with how he presented himself throughout the conversation. He also seemed genuinely interested in the role and its responsibilities. However, he did not demonstrate a clear understanding of the technical aspects of the job or provide specific examples of his skills and qualifications that would have led to a more confident answer about why they should hire him."
p65,Yes,"Yes. 

Reasoning: The candidate, despite some initial hesitations and a relatively straightforward response to behavioral questions, demonstrated leadership skills and traits that made them an attractive candidate for a position in their field. They showed confidence, decisiveness, and a willingness to take initiative, which are all valuable qualities in a job candidate. Additionally, they highlighted specific weaknesses (e.g., diving into interviews too quickly) as areas for improvement and provided actionable advice on how to overcome those issues, indicating a growth mindset and self-awareness. Overall, the candidate's responses suggested that they have potential, skills, and a good attitude, which are essential for success in most professional settings."
