id,job_offered,analysis
pp35,Yes,"Yes, the candidate was offered the job at Standard & Poor's. My reasoning is that despite some initial hesitation in sharing their leadership qualities and team-player skills, the candidate provided specific examples from their experiences to demonstrate these traits, which were well-received by the interviewer. Additionally, they showed a willingness to take initiative and adapt to changing circumstances (e.g., not having access to a missing project component), suggesting that they would be able to thrive in the fast-paced environment of finance. The candidate's strong communication skills and ability to articulate their thoughts and actions also helped to build rapport with the interviewer."
pp37,Yes,"Yes. The candidate did not get the job. Although the interviewer seemed to be impressed with his qualifications and experience, he failed to demonstrate any initiative on his part to address potential weaknesses, such as asking for help when needed. He also made a comment about learning from others without taking specific steps to do so, which may indicate that he is not yet self-aware of areas where he can improve."
pp4,Yes,"Yes. The candidate was offered the position of leader in a team, and also demonstrated strong leadership skills through his involvement in various extracurricular activities such as the MedLinks organization and the MIT Tapioca Club. Additionally, he showed empathy and compassion, particularly during a scenario where he had to help another team member who was struggling with their role. Overall, these experiences have prepared him well for the kind of employee that the employer is looking for."
pp42,Yes,Yes.
pp43,Yes,"Yes, the candidate was offered the position of Match-Maker Computer Science double major at MIT."
pp44,Yes,"Yes. The candidate, although not entirely polished in their responses, showed a clear eagerness to learn and grow within the company, as evidenced by his enthusiasm for learning new technologies and frameworks. His willingness to take risks and step out of his comfort zone (in terms of trying something he's not familiar with) also suggests that he would be a strong fit for the role. Additionally, his interest in consumer products front-end development and experience in testing and QA roles further indicate a potential fit. However, it's worth noting that his responses lacked some polish and clarity, which may have raised concerns about his ability to effectively communicate complex ideas or take on more senior responsibilities within the company."
pp45,Yes,"Yes. The candidate appears to have had an effective conversation, showcasing their technical expertise, leadership potential, and problem-solving skills. They also demonstrated a willingness to learn from others' perspectives and acknowledge areas for improvement. However, there were no concrete examples of how they would apply these qualities in a specific job or industry, which might be seen as a limitation. Overall, the interview provided some insight into the candidate's background, motivations, and strengths, making it a relatively strong performance."
pp47,Yes,"Yes. The candidate was successful in making a good impression during the interview, showcasing their relevant skills and experience, and demonstrating self-awareness about areas for improvement. However, it's also possible to interpret this outcome as neutral, given that the conversation seemed balanced between the candidate's strengths and weaknesses. Ultimately, whether or not the candidate should get the job depends on various factors, including the company's specific needs, the role's requirements, and the candidate's overall fit with the organization."
pp48,Yes,"Yes, the candidate got the job. The interviewer asked a series of behavioral questions that seemed to assess the candidate's leadership skills, teamwork abilities, and problem-solving experience. The candidate demonstrated strong leadership traits such as taking initiative, creating vision, and forming infinite choices, which were evident in their responses. They also showed a willingness to work collaboratively with others, think on their feet, and adapt to changing situations. Additionally, the candidate's self-awareness and openness to feedback (e.g., mentioning that they might not be able to sleep as well) were impressive. Overall, the interview seemed to suggest that the candidate has the necessary skills and qualities to excel in a leadership role."
pp49,Yes,"Yes. The candidate, despite showing some enthusiasm and potential for growth, didn't seem to grasp the nuances of working in a team environment as effectively as we were hoping. His tendency to work alone and make assumptions based on his lack of experience would be significant hurdles in any professional setting. While it's commendable that he showed interest in Bioengineering and a desire to contribute to its development, he needed more concrete examples of how he would handle complex problems and lead a team effectively."
pp5,Yes,"Yes. The candidate was selected for the position after a thorough interview process, as evident from their ability to articulate their background, demonstrate leadership qualities, showcase teamwork skills, and exhibit knowledge in their field."
pp50,Yes,"Yes. The candidate appeared to be well-prepared, articulate, and enthusiastic during the interview. They demonstrated a strong technical background and experience in leadership roles, which aligns with the requirements of the quantitative trading position. Additionally, they highlighted their ability to work under pressure, adapt to changing circumstances, and make sacrifices for the greater good - all valuable traits for a quantitative trader.

However, it's worth noting that the interview was quite structured, with a clear format and questions. While this may have helped to ensure that the candidate was on track to answer the questions effectively, it also made them appear somewhat generic in their responses. Furthermore, there were no surprises or unexpected revelations during the conversation, which might suggest that they may not be able to think outside the box or come up with creative solutions.

Overall, while the candidate showed promising qualities, I would have liked to see more nuance and depth in their answers, particularly when discussing the specific requirements of the job. Nevertheless, based on this interview alone, it appears that they are a strong candidate for the position."
pp52,Yes,"Yes. The candidate was given an opportunity to address a question that was not asked directly, but it appears that they did so in a way that effectively demonstrated their skills and fit for the role. They showed leadership qualities through sharing experiences like being a team leader and overcoming challenges, which are relevant to the job requirements. Additionally, their discussion on wanting to explore different aspects of themselves and potentially pursuing a career outside of rowing highlights their self-awareness and ambition, which could be attractive to potential employers."
pp53,Yes,"Yes. The candidate was offered a position in medical school, likely at an institution such as Harvard Medical School or another reputable program in the United States. This is evident from their interest in pursuing a career in medicine and their passion for working with children, particularly neonatologists. Additionally, they express confidence in their ability to make a good doctor and bring valuable knowledge from MIT to the medical field."
pp55,Yes,"Yes. The candidate was offered the job, and it can be inferred that they were hired for their unique combination of leadership, technical, and soft skills, as well as their passion for math and community involvement. Additionally, they demonstrated a willingness to learn and grow from their experiences, such as in the case of the Boston area project where they learned from mistakes and improved their team's process."
pp56,No,"No. 

The reason for this answer is that, despite a strong interview performance and compelling answers to behavioral questions, the candidate's responses often lacked depth and showed significant areas of self-doubt. While they demonstrated enthusiasm for medical school and helping others, their discussion of leadership skills and teamwork revealed significant gaps in their preparation or experience. Additionally, their struggles with public speaking and nervousness suggested that they may need more practice and development in these areas before being considered for a role like the one they described."
pp57,Yes,"Yes. The candidate was offered the position of Junior at MIT, specifically working on the consulting team for their Gordan Engineering leadership program, after a thorough interview process that evaluated their technical skills, leadership abilities, and fit with the company culture."
pp58,Yes,"Yes. The candidate was hired for the position of ocean engineer at a prominent research institution, indicating that they met the essential qualifications and were deemed suitable for the role based on their experience, skills, and personal qualities discussed during the interview process."
pp59,Yes,Yes.
pp6,No,"No. While the candidate presented some strong points, such as their technical skills and experience in a competitive field, they also lacked significant relevant work experience in finance, which is a critical component of the role. Additionally, their lack of formal training in finance raised concerns about their ability to perform the duties of the position without extensive additional education or training."
pp60,No,"No. Although the candidate did discuss their qualifications, leadership skills, and experiences in detail, he struggled to articulate how these qualities would directly benefit the organization and specifically why they should be hired for the position. His responses often relied on general statements about being a team player or having good communication skills, rather than providing concrete examples from his experiences that demonstrated these abilities. Additionally, he seemed hesitant to take ownership of specific projects or initiatives, instead relying on hypothetical scenarios or vague claims about his potential contributions. Overall, while the candidate showed promise and enthusiasm for the role, their responses did not clearly demonstrate how they would meet the needs of the organization or why they should be hired over other candidates."
pp61,Yes,"Yes. The candidate was offered a position as an Aerospace Engineer at MIT, specifically as part of the Naval Research and Technical Center (NRTC) program, where they would commission as an officer after completing their junior year."
pp62,No,"No. The candidate did not get the job. While they showed strong responses throughout the interview, their answers were mostly positive and enthusiastic about their background, experience, and passion for medicine. However, there was no indication that they had a clear understanding of the specific requirements or qualifications mentioned in the job posting or that they could address any potential concerns or weaknesses in their application.

Additionally, some of the questions asked by the interviewer seemed to be more like an opportunity for them to showcase their personality and interests rather than probing deeper into their qualifications. For example, when asked about a conflict in their team, they chose to discuss a personal experience with anxiety rather than providing evidence from their work or lab experience.

Overall, while the candidate's responses were engaging and seemed well-suited for a leadership role, it was unclear how they would translate those skills and qualities into the demands of a medical school program."
pp63,No,"No. The candidate had a pretty strong background in computer science and engineering, which would likely be an asset in a software engineering role at a tech company. However, the interviewer raised several concerns about the candidate's ability to lead and manage their time effectively, such as procrastination and a lack of accountability. These issues might have raised doubts about the candidate's potential for success in this type of position."
pp64,Yes,"Yes. The candidate, Andre, appeared to have a strong background in engineering and computer science, particularly in areas such as electrical engineering, information technologies, artificial intelligence, machine learning, device physics, digital electronics, and nanoscale semiconductor devices. He also demonstrated leadership skills through his experience as a team lead during the robotics competition and a team member in other projects.

While Andre's answers provided some insights into his thought process and problem-solving strategies, there were moments where he could have been more concise and engaging for potential employers. For example, when asked about becoming more succinct in how he speaks, it would be helpful to see a specific example or anecdote that illustrates this skill.

Additionally, while Andre mentioned Steve Jobs as an inspiration, he did not provide any specific examples of times when he had successfully balanced his geeky personality with inspiring leadership skills. Providing concrete anecdotes can help to showcase the candidate's potential for success in this role.

Overall, however, Andre presented a strong and thoughtful set of answers that demonstrated his technical expertise and leadership abilities. With some refinement in terms of clarity and engagement, he could be an excellent candidate for a project lead or electronic product design team position."
pp65,Yes,Yes.
pp66,Yes,"Yes. The candidate was able to effectively demonstrate their leadership skills, teamwork experience, and technical expertise, which are all valuable assets in a position like this. They also showed self-awareness about areas where they need to improve, such as delegating responsibilities and letting others take ownership of projects. Overall, the interview provided insight into the candidate's potential fit for the role and their ability to adapt to leadership positions."
pp67,No,"No. While the candidate expressed interest in consulting and a desire to work on teams, their lack of specific experience and interests in energy or connectors were notable. Additionally, their mention of not being interested in grad school at the moment suggested that they may have been prioritizing undergraduate studies over professional development."
pp69,Yes,"Yes. The candidate's qualifications and experiences were well-suited to the position of a mechanical engineer at MIT, particularly in terms of his background in computer science and electro engineering, as well as his leadership skills demonstrated through his experience in guiding a robotics project group. His willingness to learn new things and work hard also made him an attractive candidate for the role."
pp7,No,"No. Although the candidate demonstrated a strong background in engineering, computer science, mathematics, leadership, and teamwork, their response lacked specific answers about why they should be hired and provided no concrete examples of how they would apply their skills to the company's goals."
pp70,Yes,"Yes, I believe the candidate should get into graduate school. Although they did express concerns about their self-confidence and the challenges of integrating in a new country, these are areas where they demonstrated growth and a desire to improve. The fact that they mentioned being dedicated to research and wanting to contribute to the scientific world suggests that they have strong motivations for pursuing further education. Furthermore, their academic background and specific interests (marine microbiology) indicate that they have a clear passion for their field, which is typically a strong indicator of potential success in graduate school."
pp71,No,"No. The candidate did not get the job. While they provided a good interview performance, including highlighting their relevant coursework and intern experience, there were a few red flags that raised concerns about their suitability for the position.

One major concern was their lack of self-awareness on their leadership skills. When asked if they thought they were a leader, they mentioned that they wouldn't necessarily run for positions but would step up to lead when necessary. However, in an ideal world, it's crucial to have leaders who are confident in their abilities and willing to take charge.

Additionally, the candidate seemed hesitant to be specific about their technical strengths, instead focusing on soft skills like communication and teamwork. While these traits can be valuable in many contexts, they may not necessarily translate to a role in building technology, where technical expertise is paramount.

The interviewer also raised questions about their ability to manage conflicts effectively. When asked about a conflict on the team that needed to be resolved, the candidate provided an example of how they and their coach worked together to achieve success. However, this was followed by a comment that suggested they sometimes prioritize perfection over efficiency, which may not be ideal for a role in building technology.

Finally, while the candidate mentioned their interest in building technology and their parents' background as architects, these statements were met with a somewhat casual tone, which might suggest that they are not taking their potential employer's expectations very seriously. In a job interview, it's essential to demonstrate a more serious commitment to the role and its responsibilities."
pp72,Yes,"Yes. The candidate was offered the linguistics research position, which suggests that they were successful in their interview and demonstrated their qualifications for the role."
pp73,Yes,"Yes. The candidate was offered a position at MIT, which suggests that they were selected for the role based on their qualifications and fit for the position."
pp74,No,"No. While the interview went well, there were several issues that raise concerns about the candidate's fit for the role and company culture. For example:

* The interviewer mentioned that the candidate has been involved in music groups across campus, but did not elaborate on their current involvement or how it relates to their skills and experience.
* There was no mention of the candidate's experience with web programming or their ability to learn new technologies quickly.
* The interviewer asked about the candidate's comfort level meeting new people, which is a concern given that they will be working in an office environment where there may be differing personalities and work styles.
* While the candidate mentioned their enjoyment of learning new things, it did not specifically mention web programming or any other relevant skills.

Overall, while the interview was positive, there were some significant gaps in information about the candidate's qualifications and fit for the role that raised concerns."
pp76,Yes,"Yes. The candidate, Zaynab, did not secure the job position. While she presented her qualifications and experiences effectively during the interview, several red flags were raised that may have contributed to this outcome.

One major concern was her lack of leadership experience. Although she mentioned holding various leadership positions at college, these roles seemed to be relatively minor and focused on social events rather than significant projects or initiatives.

Additionally, Zaynab's response to questions about her leadership style and conflict resolution skills raised some doubts. While she acknowledged that others may not have been pulling their weight, her solution of simply ""blocking out time"" might not have addressed the underlying issues. Furthermore, her comment that she wished she was more outgoing came across as somewhat dismissive or even passive-aggressive.

Another area where Zaynab's performance fell short was in addressing potential risks or concerns about her background and experiences. While she mentioned being a chemical engineer at MIT, she did not provide much context or detail about her academic and professional journey. This lack of transparency might raise questions among hiring managers about her ability to navigate complex projects or handle unexpected challenges.

Finally, Zaynab's response to the question about why she thinks she should get the job was somewhat generic. While it is true that having a strong academic background and experience working with various teams are valuable assets, this answer did not demonstrate any significant insights or unique strengths that would make her an exceptional candidate for the position.

Overall, while Zaynab presented herself as a capable and motivated individual, several factors contributed to her limited chances of securing the job."
pp77,Yes,"Yes. The candidate was offered the position of product manager and communications specialist at the company, as indicated by their positive responses to the interview questions about their background, leadership skills, team collaboration, conflict resolution, time management, and fit with the company culture."
pp78,Yes,"Yes, the candidate was hired for the software engineering position."
pp79,Yes,"Yes. The candidate, Jessica Aria, seemed to have a strong portfolio and demonstrated her technical skills, leadership qualities, and passion for working in the energy education and robotics industries. She also showed initiative and a willingness to learn, as evidenced by her discussions about her career goals and aspirations. However, it's worth noting that the interview was relatively short, and the candidate didn't provide any clear evidence of significant work experience or achievements outside of academia. Additionally, some points, such as her lack of understanding of math in high school and her desire to learn more in this field at a later age, raised concerns about her readiness for a full-time position. Nevertheless, overall, she presented herself as a motivated and enthusiastic candidate who could contribute positively to the company."
pp8,Yes,"Yes. The candidate was well-prepared and articulate throughout the interview, showcasing their technical skills and leadership qualities. They also demonstrated a strong interest in pattern recognition and machine learning, which is relevant to the role they are applying for. Additionally, they highlighted their ability to work collaboratively, manage multiple tasks, and adapt to different study styles, all of which are valuable assets for an intern working with data analysis and machine learning projects. Overall, the candidate presented a strong case for why they should be considered for the job."
pp80,Yes,"Yes. The candidate was offered a position at MIT, specifically as the head of the Greek MedLinks program."
pp81,Yes,"Yes. The candidate was selected for the position due to their strong background in brain and cognitive science, particularly in a longitudinal study, which demonstrated their understanding of the emerging field of pharmacology. Their leadership skills, including effective communication, delegation, and team management, were also highlighted as key strengths. Additionally, their ability to maintain organizational structure despite a complex workload and manage competing interests was seen as a valuable asset. Overall, their unique combination of academic background, personal qualities, and professional experience made them an attractive candidate for the role."
pp83,No,"No. Although the candidate showed a good foundation in their background, particularly in physics and neuroscience, they struggled to articulate specific examples of leadership skills and demonstrated some nervousness that prevented them from fully showcasing their strengths. The candidate also seemed uncertain about how to effectively address potential conflicts or team-building challenges, which could be an important aspect of a leader's role."
pp84,No,"No. The candidate did not get the job. While they demonstrated some leadership skills, such as being elected president of Amnesty International and taking initiative in other projects, there were also some areas where they struggled to demonstrate their team-playing ability, public speaking skills, and understanding of industry-specific knowledge. Additionally, their response about needing to become a better public speaker was more of a personal desire than a genuine attempt to improve their skills."
pp85,Yes,"Yes. The candidate was offered the software internship position at MIT, which they accepted."
pp86,Yes,"Yes. The candidate was offered the job, primarily due to his extensive experience and knowledge in robotics, mechanical engineering, and hands-on work with robots, which aligns well with the requirements of the position. His calm demeanor, sociability, and ability to effectively communicate with team members were also noted as positive traits. However, it's worth noting that there was some uncertainty about time management during the interview process, but ultimately, his enthusiasm for working at the company and his fit with their values seemed to outweigh any concerns about his time management skills."
